[
  {
    "id": "ASD_PATHO_1",
    "topic": "acyanotic",
    "lesion": "Atrial Septal Defect (secundum/primum/sinus venosus)",
    "category": "pathophysiology",
    "type": "mcq",
    "stem": "A 6-year-old with a secundum ASD has right atrial and ventricular dilation on echocardiogram. Which physiologic consequence best explains this finding?",
    "options": [
      "Right atrial and ventricular volume overload from chronic left-to-right shunt",
      "Systemic hypoxemia from reduced pulmonary blood flow",
      "Pressure overload of the left ventricle from systemic hypertension",
      "Obstruction to pulmonary venous return across the atrial septum"
    ],
    "answerIndex": 0,
    "explanation": "Because left atrial pressure exceeds right atrial pressure, secundum ASDs create a left-to-right shunt that chronically volume loads the right heart and pulmonary circulation.",
    "tags": [
      "left-to-right shunt",
      "fixed split S2"
    ],
    "difficulty": 2,
    "objective": "Revisit the hemodynamics that produce right-sided dilation and a fixed, split S2 in ASD.",
    "references": [],
    "version": "v1"
  },
  {
    "id": "ASD_EXAM_2",
    "topic": "acyanotic",
    "lesion": "Atrial Septal Defect (secundum/primum/sinus venosus)",
    "category": "exam/murmur",
    "type": "mcq",
    "stem": "On physical exam, which auscultatory finding most strongly suggests an atrial septal defect?",
    "options": [
      "Fixed, widely split S2 that does not vary with respiration",
      "Continuous machinery murmur at the left infraclavicular area",
      "Late systolic murmur with mid-systolic click at the apex",
      "Holosystolic murmur at the apex radiating to the axilla"
    ],
    "answerIndex": 0,
    "explanation": "A fixed and wide splitting of S2 reflects prolonged right ventricular ejection time from the ASD shunt and is classic for ASD.",
    "tags": [
      "fixed split S2",
      "murmur"
    ],
    "difficulty": 1,
    "objective": "Pair auscultation practice with diagrams of S2 splitting patterns to reinforce ASD recognition.",
    "references": [],
    "version": "v1"
  },
  {
    "id": "VSD_PRESENT_1",
    "topic": "acyanotic",
    "lesion": "Ventricular Septal Defect (perimembranous/muscular)",
    "category": "presentation",
    "type": "mcq",
    "stem": "A 2-month-old with a moderate perimembranous VSD has tachypnea, poor weight gain, and a harsh holosystolic murmur at the left lower sternal border. What drives these symptoms?",
    "options": [
      "Excess pulmonary blood flow causing pulmonary overcirculation and heart failure",
      "Systemic hypoxemia from obligate right-to-left shunt",
      "Acute closure of the ductus arteriosus reducing systemic flow",
      "Arrhythmia-mediated cardiogenic shock"
    ],
    "answerIndex": 0,
    "explanation": "Large or moderate VSDs deliver significant left-to-right shunting once pulmonary vascular resistance falls, overloading the pulmonary circulation and left heart, leading to CHF symptoms in infancy.",
    "tags": [
      "failure to thrive",
      "holosystolic murmur"
    ],
    "difficulty": 1,
    "objective": "Connect VSD size with timing of symptoms as pulmonary vascular resistance normalizes after birth.",
    "references": [],
    "version": "v1"
  },
  {
    "id": "VSD_MGMT_2",
    "topic": "acyanotic",
    "lesion": "Ventricular Septal Defect (perimembranous/muscular)",
    "category": "management_initial",
    "type": "mcq",
    "stem": "An infant with a large VSD and failure to thrive remains symptomatic despite adequate calories. What is the best initial management step while awaiting surgical evaluation?",
    "options": [
      "Start diuretics and afterload reduction to control pulmonary overcirculation",
      "Begin prostaglandin E1 to maintain ductal patency",
      "Recommend endocardial cushion defect repair immediately",
      "Switch to low-iron formula to reduce metabolic demand"
    ],
    "answerIndex": 0,
    "explanation": "Medical management with diuretics (\u00b1ACE inhibition) alleviates congestive symptoms while definitive repair is arranged for a large VSD.",
    "tags": [
      "heart failure therapy"
    ],
    "difficulty": 2,
    "objective": "Review the bridge-to-surgery measures for volume-overload lesions like sizable VSDs.",
    "references": [],
    "version": "v1"
  },
  {
    "id": "AVSD_PATHO_1",
    "topic": "acyanotic",
    "lesion": "Atrioventricular Septal Defect (partial/complete)",
    "category": "pathophysiology",
    "type": "mcq",
    "stem": "Complete AVSD in a neonate with Down syndrome most commonly causes which hemodynamic issue?",
    "options": [
      "Common AV valve regurgitation with massive left-to-right shunting at both atrial and ventricular levels",
      "Isolated obstruction to pulmonary venous return into the left atrium",
      "Right ventricular outflow tract obstruction leading to cyanosis",
      "Severe systemic outflow obstruction causing differential cyanosis"
    ],
    "answerIndex": 0,
    "explanation": "Failure of endocardial cushion fusion creates defects at both septa and a common AV valve, producing significant left-to-right shunting and AV valve regurgitation.",
    "tags": [
      "endocardial cushion",
      "Down syndrome"
    ],
    "difficulty": 2,
    "objective": "Map the shared AV valve anatomy to understand regurgitation and pulmonary overcirculation in AVSD.",
    "references": [],
    "version": "v1"
  },
  {
    "id": "AVSD_IMAGING_2",
    "topic": "acyanotic",
    "lesion": "Atrioventricular Septal Defect (partial/complete)",
    "category": "imaging_ecg_cxr",
    "type": "mcq",
    "stem": "Which study best confirms the diagnosis of an atrioventricular septal defect in a symptomatic infant?",
    "options": [
      "Transthoracic echocardiogram demonstrating a common AV valve and primum defect",
      "Chest radiograph showing boot-shaped cardiac silhouette",
      "Electrocardiogram with right axis deviation and RVH",
      "Cardiac MRI showing anomalous pulmonary venous return"
    ],
    "answerIndex": 0,
    "explanation": "Echocardiography delineates the common AV valve, inlet VSD, and primum ASD that define AVSD.",
    "tags": [
      "echocardiogram",
      "left axis deviation"
    ],
    "difficulty": 2,
    "objective": "Practice reading apical four-chamber echo views that highlight the primum defect and common valve leaflets.",
    "references": [],
    "version": "v1"
  },
  {
    "id": "PDA_EXAM_1",
    "topic": "acyanotic",
    "lesion": "Patent Ductus Arteriosus",
    "category": "exam/murmur",
    "type": "mcq",
    "stem": "A premature infant has a continuous \u201cmachinery\u201d murmur best heard at the left infraclavicular area. Which lesion does this finding suggest?",
    "options": [
      "Patent ductus arteriosus with left-to-right shunt",
      "Pulmonary stenosis with ejection click",
      "Coarctation of the aorta with collateral flow",
      "Tricuspid regurgitation from Ebstein anomaly"
    ],
    "answerIndex": 0,
    "explanation": "The classic continuous machinery murmur localized to the left infraclavicular region signifies persistent ductal flow in PDA.",
    "tags": [
      "continuous murmur"
    ],
    "difficulty": 1,
    "objective": "Link murmur timing to hemodynamics\u2014continuous murmurs reflect persistent systolic and diastolic gradients as in PDA.",
    "references": [],
    "version": "v1"
  },
  {
    "id": "PDA_MGMT_2",
    "topic": "acyanotic",
    "lesion": "Patent Ductus Arteriosus",
    "category": "management_initial",
    "type": "mcq",
    "stem": "A preterm neonate with respiratory distress syndrome develops a hemodynamically significant PDA. Which initial therapy is most appropriate?",
    "options": [
      "Administer indomethacin or ibuprofen to promote ductal closure",
      "Begin prostaglandin E1 infusion",
      "Schedule immediate surgical ligation without medical trial",
      "Start propranolol to reduce ductal flow"
    ],
    "answerIndex": 0,
    "explanation": "Cyclooxygenase inhibitors such as indomethacin/ibuprofen are first-line to close a symptomatic PDA in a premature infant.",
    "tags": [
      "indomethacin",
      "prematurity"
    ],
    "difficulty": 2,
    "objective": "Remember the opposing roles of prostaglandins: inhibit them to close PDA, infuse them to keep duct-dependent lesions open.",
    "references": [],
    "version": "v1"
  },
  {
    "id": "PAPVR_PATHO_1",
    "topic": "acyanotic",
    "lesion": "Partial Anomalous Pulmonary Venous Return",
    "category": "pathophysiology",
    "type": "mcq",
    "stem": "Partial anomalous pulmonary venous return (PAPVR) most commonly produces which physiologic effect?",
    "options": [
      "Left-to-right shunt with right-sided volume overload due to anomalous pulmonary veins draining to the right atrium",
      "Right-to-left shunt causing profound cyanosis in the newborn period",
      "Obstruction to pulmonary venous return with pulmonary edema and hemoptysis",
      "Systemic outflow obstruction leading to upper extremity hypertension"
    ],
    "answerIndex": 0,
    "explanation": "When one or more pulmonary veins drain anomalously to the right atrium or SVC, oxygenated blood recirculates to the right heart, creating a left-to-right shunt and right-sided dilation.",
    "tags": [
      "right heart dilation"
    ],
    "difficulty": 3,
    "objective": "Contrast PAPVR with TAPVR\u2014partial lesions are often acyanotic and mimic ASD physiology.",
    "references": [],
    "version": "v1"
  },
  {
    "id": "PAPVR_IMAGING_2",
    "topic": "acyanotic",
    "lesion": "Partial Anomalous Pulmonary Venous Return",
    "category": "imaging_ecg_cxr",
    "type": "mcq",
    "stem": "Which imaging modality best defines the anomalous pulmonary venous connection in PAPVR when echocardiography is inconclusive?",
    "options": [
      "Cardiac CT angiography delineating anomalous pulmonary venous drainage",